{"round": "mass_118", "base": "mass_119", "label": "R113 batch25 118", "passed": "5/5", "tokens": 3712, "verdict": "KEEP", "tokens_delta": -703, "tokens_pct": -15.9, "wall_delta_ms": -36959, "improved": [], "regressed": [], "per_case": [{"id": "C01_general_qa", "dtokens": -21}, {"id": "C03_subtask", "dtokens": -739}, {"id": "C06_executive_unit_convert", "dtokens": 0}, {"id": "C08_reasoning", "dtokens": -33}, {"id": "C11_json_format", "dtokens": 90}]}
{"round": "mass_119", "base": "mass_118", "label": "R113 batch25 119", "passed": "5/5", "tokens": 4415, "verdict": "REVIEW", "tokens_delta": 703, "tokens_pct": 18.9, "wall_delta_ms": 36959, "improved": [], "regressed": [], "per_case": [{"id": "C01_general_qa", "dtokens": 21}, {"id": "C03_subtask", "dtokens": 739}, {"id": "C06_executive_unit_convert", "dtokens": 0}, {"id": "C08_reasoning", "dtokens": 33}, {"id": "C11_json_format", "dtokens": -90}]}
{"round": "mass_120", "base": "mass_119", "label": "R113 batch25 120", "passed": "5/5", "tokens": 3885, "verdict": "KEEP", "tokens_delta": -530, "tokens_pct": -12.0, "wall_delta_ms": 1866, "improved": [], "regressed": [], "per_case": [{"id": "C01_general_qa", "dtokens": 11}, {"id": "C03_subtask", "dtokens": -446}, {"id": "C06_executive_unit_convert", "dtokens": 0}, {"id": "C08_reasoning", "dtokens": -477}, {"id": "C11_json_format", "dtokens": 382}]}
{"round": "mass_121", "base": "mass_120", "label": "R113 batch25 121", "passed": "5/5", "tokens": 3729, "verdict": "KEEP", "tokens_delta": -156, "tokens_pct": -4.0, "wall_delta_ms": -15036, "improved": [], "regressed": [], "per_case": [{"id": "C01_general_qa", "dtokens": 0}, {"id": "C03_subtask", "dtokens": -270}, {"id": "C06_executive_unit_convert", "dtokens": 0}, {"id": "C08_reasoning", "dtokens": 486}, {"id": "C11_json_format", "dtokens": -372}]}
{"round": "mass_122", "base": "mass_121", "label": "R113 batch25 122", "passed": "5/5", "tokens": 3585, "verdict": "KEEP", "tokens_delta": -144, "tokens_pct": -3.9, "wall_delta_ms": -20548, "improved": [], "regressed": [], "per_case": [{"id": "C01_general_qa", "dtokens": -10}, {"id": "C03_subtask", "dtokens": 129}, {"id": "C06_executive_unit_convert", "dtokens": 0}, {"id": "C08_reasoning", "dtokens": -226}, {"id": "C11_json_format", "dtokens": -37}]}
{"round": "mass_118", "label": "R113 batch25 118 post-llmservice-removal", "passed": "5/5", "tokens": 4754, "verdict": "KEEP"}
{"round": "mass_119", "label": "R113 batch25 119 post-llmservice-removal", "passed": "5/5", "tokens": 4054, "verdict": "KEEP"}
{"round": "mass_120", "label": "R113 batch25 120 post-llmservice-removal", "passed": "5/5", "tokens": 3886, "verdict": "KEEP"}
{"round": "mass_121", "label": "R113 batch25 121 post-llmservice-removal", "passed": "5/5", "tokens": 4367, "verdict": "KEEP"}
{"round": "mass_122", "label": "R113 batch25 122 post-llmservice-removal", "passed": "5/5", "tokens": 4240, "verdict": "KEEP"}
