{"round": "round2", "base": "baseline2", "label": "裁决修复+executive DI 承载修复后", "passed": "8/10", "tokens": 7615, "verdict": "KEEP", "tokens_delta": -1454, "tokens_pct": -16.0, "wall_delta_ms": -100178, "improved": ["C05_skill_wordcount"], "regressed": []}
{"round": "round3", "base": "baseline_final", "label": "隔离DI+goal实体+缓存标记+assembly统计 修复后", "passed": "10/10", "tokens": 7444, "verdict": "KEEP", "tokens_delta": 90, "tokens_pct": 1.2, "wall_delta_ms": -58682, "improved": [], "regressed": []}
{"round": "round4", "base": "baseline_final", "label": "prompt_build+compression 打点 + R5 历史滚动摘要", "passed": "10/10", "tokens": 7329, "verdict": "KEEP", "tokens_delta": -25, "tokens_pct": -0.3, "wall_delta_ms": -29197, "improved": [], "regressed": []}
{"round": "round5", "base": "round4", "label": "R6 存储召回同源+中文2gram 分词 (召回率 0→有效)", "passed": "10/10", "tokens": 7457, "verdict": "KEEP", "tokens_delta": 128, "tokens_pct": 1.7, "wall_delta_ms": -35725, "improved": [], "regressed": []}
{"round": "round6", "base": "round5", "label": "evidence_gate 打点 (问询触发率观测)", "passed": "10/10", "tokens": 8241, "verdict": "KEEP", "tokens_delta": 784, "tokens_pct": 10.5, "wall_delta_ms": 60894, "improved": [], "regressed": []}
{"round": "round6", "base": "round5", "label": "evidence_gate 打点 (问询触发率观测)", "passed": "10/10", "tokens": 8241, "verdict": "KEEP", "tokens_delta": 784, "tokens_pct": 10.5, "wall_delta_ms": 60894, "improved": [], "regressed": [], "per_case": [{"id": "C01_general_qa", "dtokens": 39}, {"id": "C02_coding", "dtokens": 100}, {"id": "C03_subtask", "dtokens": 0}, {"id": "C04_skill_identity", "dtokens": 0}, {"id": "C05_skill_wordcount", "dtokens": 0}, {"id": "C06_negative_identity", "dtokens": -21}, {"id": "C07_memory_followup", "dtokens": 31}, {"id": "C08_reasoning", "dtokens": 635}, {"id": "C09_balance_cmd", "dtokens": 0}, {"id": "C10_model_list", "dtokens": 0}]}
{"round": "round7", "base": "round6", "label": "R11 workspace 召回实现 (0→3snip)+R11b root fallback", "passed": "10/10", "tokens": 8554, "verdict": "KEEP", "tokens_delta": 313, "tokens_pct": 3.8, "wall_delta_ms": -28424, "improved": [], "regressed": [], "per_case": [{"id": "C01_general_qa", "dtokens": 359}, {"id": "C02_coding", "dtokens": 71}, {"id": "C03_subtask", "dtokens": 82}, {"id": "C04_skill_identity", "dtokens": 0}, {"id": "C05_skill_wordcount", "dtokens": 0}, {"id": "C06_negative_identity", "dtokens": 151}, {"id": "C07_memory_followup", "dtokens": 4}, {"id": "C08_reasoning", "dtokens": -354}, {"id": "C09_balance_cmd", "dtokens": 0}, {"id": "C10_model_list", "dtokens": 0}]}
{"round": "round8", "base": "round7", "label": "assembly/prompt_build/gate 全指标采集版", "passed": "10/10", "tokens": 8650, "verdict": "KEEP", "tokens_delta": 96, "tokens_pct": 1.1, "wall_delta_ms": 13227, "improved": [], "regressed": [], "per_case": [{"id": "C01_general_qa", "dtokens": -146}, {"id": "C02_coding", "dtokens": -127}, {"id": "C03_subtask", "dtokens": 0}, {"id": "C04_skill_identity", "dtokens": 0}, {"id": "C05_skill_wordcount", "dtokens": 0}, {"id": "C06_negative_identity", "dtokens": -63}, {"id": "C07_memory_followup", "dtokens": 41}, {"id": "C08_reasoning", "dtokens": 391}, {"id": "C09_balance_cmd", "dtokens": 0}, {"id": "C10_model_list", "dtokens": 0}]}
{"round": "round9", "base": "round8", "label": "R14 倾向写入链+goalIntent参数+goal锚定收窄+bias融合", "passed": "10/10", "tokens": 8316, "verdict": "KEEP", "tokens_delta": -334, "tokens_pct": -3.9, "wall_delta_ms": 41424, "improved": [], "regressed": [], "per_case": [{"id": "C01_general_qa", "dtokens": -7}, {"id": "C02_coding", "dtokens": 84}, {"id": "C03_subtask", "dtokens": 0}, {"id": "C04_skill_identity", "dtokens": 0}, {"id": "C05_skill_wordcount", "dtokens": 0}, {"id": "C06_negative_identity", "dtokens": 132}, {"id": "C07_memory_followup", "dtokens": -17}, {"id": "C08_reasoning", "dtokens": -526}, {"id": "C09_balance_cmd", "dtokens": 0}, {"id": "C10_model_list", "dtokens": 0}]}
{"round": "round10", "base": "round9", "label": "R15 币种换算+余额感知排序+假绿修复(357)", "passed": "10/10", "tokens": 9109, "verdict": "KEEP", "tokens_delta": 793, "tokens_pct": 9.5, "wall_delta_ms": -60699, "improved": [], "regressed": [], "per_case": [{"id": "C01_general_qa", "dtokens": 465}, {"id": "C02_coding", "dtokens": 43}, {"id": "C03_subtask", "dtokens": 0}, {"id": "C04_skill_identity", "dtokens": 0}, {"id": "C05_skill_wordcount", "dtokens": 0}, {"id": "C06_negative_identity", "dtokens": 222}, {"id": "C07_memory_followup", "dtokens": -33}, {"id": "C08_reasoning", "dtokens": 96}, {"id": "C09_balance_cmd", "dtokens": 0}, {"id": "C10_model_list", "dtokens": 0}]}
{"round": "round11", "base": "round10", "label": "R16 unit-convert 触发+脚本双修 (C06 executive 直达)", "passed": "9/10", "tokens": 8978, "verdict": "REVERT", "tokens_delta": -131, "tokens_pct": -1.4, "wall_delta_ms": 86673, "improved": [], "regressed": ["C06_negative_identity"], "per_case": [{"id": "C01_general_qa", "dtokens": -60}, {"id": "C02_coding", "dtokens": 0}, {"id": "C03_subtask", "dtokens": 0}, {"id": "C04_skill_identity", "dtokens": 0}, {"id": "C05_skill_wordcount", "dtokens": 0}, {"id": "C07_memory_followup", "dtokens": 476}, {"id": "C08_reasoning", "dtokens": 448}, {"id": "C09_balance_cmd", "dtokens": 0}, {"id": "C10_model_list", "dtokens": 0}]}
{"round": "round12", "base": "round10", "label": "R16 复跑 (C06 断言翻转 executive 直达)", "passed": "8/10", "tokens": 7905, "verdict": "REVERT", "tokens_delta": -1204, "tokens_pct": -13.2, "wall_delta_ms": 43496, "improved": [], "regressed": ["C02_coding"], "per_case": [{"id": "C01_general_qa", "dtokens": -576}, {"id": "C03_subtask", "dtokens": 0}, {"id": "C04_skill_identity", "dtokens": 0}, {"id": "C05_skill_wordcount", "dtokens": 0}, {"id": "C07_memory_followup", "dtokens": 372}, {"id": "C08_reasoning", "dtokens": -5}, {"id": "C09_balance_cmd", "dtokens": 0}, {"id": "C10_model_list", "dtokens": 0}]}
{"round": "round13", "base": "round10", "label": "R16 复跑2 (reply_contains 变量修)", "passed": "10/10", "tokens": 8053, "verdict": "KEEP", "tokens_delta": -1056, "tokens_pct": -11.6, "wall_delta_ms": 23770, "improved": [], "regressed": [], "per_case": [{"id": "C01_general_qa", "dtokens": -537}, {"id": "C02_coding", "dtokens": -217}, {"id": "C03_subtask", "dtokens": 0}, {"id": "C04_skill_identity", "dtokens": 0}, {"id": "C05_skill_wordcount", "dtokens": 0}, {"id": "C07_memory_followup", "dtokens": 276}, {"id": "C08_reasoning", "dtokens": 417}, {"id": "C09_balance_cmd", "dtokens": 0}, {"id": "C10_model_list", "dtokens": 0}]}
{"round": "round14", "base": "round13", "label": "R18 输出纪律 (C08 completion -35% A/B)", "passed": "10/10", "tokens": 6550, "verdict": "KEEP", "tokens_delta": -1503, "tokens_pct": -18.7, "wall_delta_ms": -9603, "improved": [], "regressed": [], "per_case": [{"id": "C01_general_qa", "dtokens": 98}, {"id": "C02_coding", "dtokens": -908}, {"id": "C03_subtask", "dtokens": 38}, {"id": "C04_skill_identity", "dtokens": 0}, {"id": "C05_skill_wordcount", "dtokens": 0}, {"id": "C06_executive_unit_convert", "dtokens": 0}, {"id": "C07_memory_followup", "dtokens": -183}, {"id": "C08_reasoning", "dtokens": -548}, {"id": "C09_balance_cmd", "dtokens": 0}, {"id": "C10_model_list", "dtokens": 0}]}
{"round": "round15", "base": "round14", "label": "R19 max_tokens 截断修复 (C03 content 0→1756字) + content_len 打点", "passed": "10/10", "tokens": 7059, "verdict": "KEEP", "tokens_delta": 509, "tokens_pct": 7.8, "wall_delta_ms": -41564, "improved": [], "regressed": [], "per_case": [{"id": "C01_general_qa", "dtokens": -304}, {"id": "C02_coding", "dtokens": -485}, {"id": "C03_subtask", "dtokens": 1412}, {"id": "C04_skill_identity", "dtokens": 0}, {"id": "C05_skill_wordcount", "dtokens": 0}, {"id": "C06_executive_unit_convert", "dtokens": 0}, {"id": "C07_memory_followup", "dtokens": 143}, {"id": "C08_reasoning", "dtokens": -257}, {"id": "C09_balance_cmd", "dtokens": 0}, {"id": "C10_model_list", "dtokens": 0}]}
{"round": "round16", "base": "round15", "label": "R20 非交互stdin吞输入修复 (PromptPersistence/CUI IsInputRedirected)", "passed": "9/10", "tokens": 2901, "verdict": "REVERT", "tokens_delta": -4158, "tokens_pct": -58.9, "wall_delta_ms": 63338, "improved": [], "regressed": ["C03_subtask"], "per_case": [{"id": "C01_general_qa", "dtokens": -28}, {"id": "C02_coding", "dtokens": 255}, {"id": "C04_skill_identity", "dtokens": 0}, {"id": "C05_skill_wordcount", "dtokens": 0}, {"id": "C06_executive_unit_convert", "dtokens": 0}, {"id": "C07_memory_followup", "dtokens": -330}, {"id": "C08_reasoning", "dtokens": -344}, {"id": "C09_balance_cmd", "dtokens": 0}, {"id": "C10_model_list", "dtokens": 0}]}
{"round": "round17", "base": "round15", "label": "R20 复跑 (round16 C03=LLM超时波动)", "passed": "10/10", "tokens": 7638, "verdict": "KEEP", "tokens_delta": 579, "tokens_pct": 8.2, "wall_delta_ms": 51295, "improved": [], "regressed": [], "per_case": [{"id": "C01_general_qa", "dtokens": 47}, {"id": "C02_coding", "dtokens": 368}, {"id": "C03_subtask", "dtokens": -335}, {"id": "C04_skill_identity", "dtokens": 0}, {"id": "C05_skill_wordcount", "dtokens": 0}, {"id": "C06_executive_unit_convert", "dtokens": 0}, {"id": "C07_memory_followup", "dtokens": -91}, {"id": "C08_reasoning", "dtokens": 590}, {"id": "C09_balance_cmd", "dtokens": 0}, {"id": "C10_model_list", "dtokens": 0}]}
{"round": "round18", "base": "round15", "label": "R21 推理档位路由 (简单意图 reasoning_effort=low)", "passed": "10/10", "tokens": 5124, "verdict": "KEEP", "tokens_delta": -1935, "tokens_pct": -27.4, "wall_delta_ms": 15382, "improved": [], "regressed": [], "per_case": [{"id": "C01_general_qa", "dtokens": 51}, {"id": "C02_coding", "dtokens": 246}, {"id": "C03_subtask", "dtokens": -2116}, {"id": "C04_skill_identity", "dtokens": 0}, {"id": "C05_skill_wordcount", "dtokens": 0}, {"id": "C06_executive_unit_convert", "dtokens": 0}, {"id": "C07_memory_followup", "dtokens": -64}, {"id": "C08_reasoning", "dtokens": -52}, {"id": "C09_balance_cmd", "dtokens": 0}, {"id": "C10_model_list", "dtokens": 0}]}
{"round": "round19", "base": "round18", "label": "R22 推理档位透传 modelqueue 全链 (deepseek 兼容)", "passed": "10/10", "tokens": 4909, "verdict": "KEEP", "tokens_delta": -215, "tokens_pct": -4.2, "wall_delta_ms": -34637, "improved": [], "regressed": [], "per_case": [{"id": "C01_general_qa", "dtokens": -218}, {"id": "C02_coding", "dtokens": 374}, {"id": "C03_subtask", "dtokens": 54}, {"id": "C04_skill_identity", "dtokens": 0}, {"id": "C05_skill_wordcount", "dtokens": 0}, {"id": "C06_executive_unit_convert", "dtokens": 0}, {"id": "C07_memory_followup", "dtokens": -374}, {"id": "C08_reasoning", "dtokens": -51}, {"id": "C09_balance_cmd", "dtokens": 0}, {"id": "C10_model_list", "dtokens": 0}]}
{"round": "round22", "base": "round19", "label": "R23 failover 兜底验证", "passed": "10/10", "tokens": 8065, "verdict": "REVIEW", "tokens_delta": 3156, "tokens_pct": 64.3, "wall_delta_ms": 43621, "improved": [], "regressed": [], "per_case": [{"id": "C01_general_qa", "dtokens": 12}, {"id": "C02_coding", "dtokens": -310}, {"id": "C03_subtask", "dtokens": 3273}, {"id": "C04_skill_identity", "dtokens": 0}, {"id": "C05_skill_wordcount", "dtokens": 0}, {"id": "C06_executive_unit_convert", "dtokens": 0}, {"id": "C07_memory_followup", "dtokens": 15}, {"id": "C08_reasoning", "dtokens": 166}, {"id": "C09_balance_cmd", "dtokens": 0}, {"id": "C10_model_list", "dtokens": 0}]}
{"round": "round24", "base": "round19", "label": "R24 LLM HttpClient 超时 100s→180s 可配置 (reasoning 长输出余量)", "passed": "10/10", "tokens": 7773, "verdict": "REVIEW", "tokens_delta": 2864, "tokens_pct": 58.3, "wall_delta_ms": 49972, "improved": [], "regressed": [], "per_case": [{"id": "C01_general_qa", "dtokens": 26}, {"id": "C02_coding", "dtokens": -338}, {"id": "C03_subtask", "dtokens": 2596}, {"id": "C04_skill_identity", "dtokens": 0}, {"id": "C05_skill_wordcount", "dtokens": 0}, {"id": "C06_executive_unit_convert", "dtokens": 0}, {"id": "C07_memory_followup", "dtokens": -5}, {"id": "C08_reasoning", "dtokens": 585}, {"id": "C09_balance_cmd", "dtokens": 0}, {"id": "C10_model_list", "dtokens": 0}]}
{"round": "round25", "base": "round19", "label": "R25 多步任务输出预算 (要点式 ≤500字)", "passed": "10/10", "tokens": 4548, "verdict": "KEEP", "tokens_delta": -361, "tokens_pct": -7.4, "wall_delta_ms": -3176, "improved": [], "regressed": [], "per_case": [{"id": "C01_general_qa", "dtokens": 69}, {"id": "C02_coding", "dtokens": -262}, {"id": "C03_subtask", "dtokens": -436}, {"id": "C04_skill_identity", "dtokens": 0}, {"id": "C05_skill_wordcount", "dtokens": 0}, {"id": "C06_executive_unit_convert", "dtokens": 0}, {"id": "C07_memory_followup", "dtokens": 108}, {"id": "C08_reasoning", "dtokens": 160}, {"id": "C09_balance_cmd", "dtokens": 0}, {"id": "C10_model_list", "dtokens": 0}]}
{"round": "round60", "base": "round51", "label": "R60 阶段全量回归", "passed": "10/10", "tokens": 4011, "verdict": "KEEP", "tokens_delta": 109, "tokens_pct": 2.8, "wall_delta_ms": 32492, "improved": [], "regressed": [], "per_case": [{"id": "C01_general_qa", "dtokens": -28}, {"id": "C02_coding", "dtokens": 158}, {"id": "C03_subtask", "dtokens": 83}, {"id": "C04_skill_identity", "dtokens": 0}, {"id": "C05_skill_wordcount", "dtokens": 0}, {"id": "C06_executive_unit_convert", "dtokens": 0}, {"id": "C07_memory_followup", "dtokens": -127}, {"id": "C08_reasoning", "dtokens": 23}, {"id": "C09_balance_cmd", "dtokens": 0}, {"id": "C10_model_list", "dtokens": 0}]}
{"round": "mass_63", "base": "mass_58", "label": "R94 batch15 63", "passed": "5/5", "tokens": 4355, "verdict": "REVIEW", "tokens_delta": 723, "tokens_pct": 19.9, "wall_delta_ms": -1265, "improved": [], "regressed": [], "per_case": [{"id": "C01_general_qa", "dtokens": 2}, {"id": "C03_subtask", "dtokens": 9}, {"id": "C06_executive_unit_convert", "dtokens": 0}, {"id": "C08_reasoning", "dtokens": 150}]}
{"round": "mass_64", "base": "mass_63", "label": "R96 batch16 64 (补账 R104)", "passed": "5/5", "tokens": 4404, "verdict": "KEEP"}
{"round": "mass_65", "base": "mass_60", "label": "R96 batch16 65 (补账 R104)", "passed": "5/5", "tokens": 3323, "verdict": "KEEP"}
{"round": "mass_66", "base": "mass_61", "label": "R96 batch16 66 (补账 R104)", "passed": "5/5", "tokens": 3810, "verdict": "KEEP"}
{"round": "mass_67", "base": "mass_62", "label": "R96 batch16 67 (补账 R104)", "passed": "5/5", "tokens": 3686, "verdict": "KEEP"}
{"round": "mass_68", "base": "mass_63", "label": "R96 batch16 68 (补账 R104)", "passed": "5/5", "tokens": 3225, "verdict": "KEEP"}
{"round": "mass_69", "base": "mass_64", "label": "R98 batch17 69 (补账 R104)", "passed": "5/5", "tokens": 3695, "verdict": "KEEP"}
{"round": "mass_70", "base": "mass_65", "label": "R98 batch17 70 (补账 R104)", "passed": "5/5", "tokens": 3428, "verdict": "KEEP"}
{"round": "mass_73", "base": "mass_68", "label": "R104 batch17 73 cloud", "passed": "5/5", "tokens": 4075, "verdict": "REVIEW", "tokens_delta": 850, "tokens_pct": 26.4, "wall_delta_ms": 69887, "improved": [], "regressed": [], "per_case": [{"id": "C01_general_qa", "dtokens": 19}, {"id": "C03_subtask", "dtokens": 632}, {"id": "C06_executive_unit_convert", "dtokens": 0}, {"id": "C08_reasoning", "dtokens": 107}, {"id": "C11_json_format", "dtokens": 92}]}
{"round": "mass_71", "base": "mass_68", "label": "R104 batch17 71 cloud", "passed": "5/5", "tokens": 4266, "verdict": "KEEP"}
{"round": "mass_72", "base": "mass_68", "label": "R104 batch17 72 cloud", "passed": "5/5", "tokens": 3984, "verdict": "KEEP"}
{"round": "mass_73", "base": "mass_68", "label": "R104 batch17 73 cloud", "passed": "5/5", "tokens": 4075, "verdict": "KEEP"}
{"round": "mass_74", "base": "mass_73", "label": "R105 batch18 74 cloud", "passed": "5/5", "tokens": 5115, "verdict": "REVIEW", "tokens_delta": 1040, "tokens_pct": 25.5, "wall_delta_ms": -8078, "improved": [], "regressed": [], "per_case": [{"id": "C01_general_qa", "dtokens": -20}, {"id": "C03_subtask", "dtokens": 859}, {"id": "C06_executive_unit_convert", "dtokens": 0}, {"id": "C08_reasoning", "dtokens": 486}, {"id": "C11_json_format", "dtokens": -285}]}
{"round": "mass_74", "base": "mass_73", "label": "R105 batch18 74 cloud", "passed": "5/5", "tokens": 5115, "verdict": "KEEP"}
{"round": "mass_75", "base": "mass_73", "label": "R105 batch18 75 cloud", "passed": "5/5", "tokens": 3414, "verdict": "KEEP"}
{"round": "mass_76", "base": "mass_73", "label": "R105 batch18 76 cloud", "passed": "5/5", "tokens": 3633, "verdict": "KEEP"}
{"round": "mass_77", "base": "mass_73", "label": "R105 batch18 77 cloud", "passed": "5/5", "tokens": 4610, "verdict": "KEEP"}
{"round": "mass_78", "base": "mass_73", "label": "R105 batch18 78 cloud", "passed": "5/5", "tokens": 3821, "verdict": "KEEP"}
{"round": "round106", "base": "round91", "label": "R106 full 14-case", "passed": "14/14", "tokens": 8332, "verdict": "KEEP", "note": "tokens+36% vs r91 = LLM output style drift (C13 completion 120→756, 语义断言全过), 无回归证据"}
{"round": "mass_79", "base": "mass_78", "label": "R106 batch19 79 cloud", "passed": "5/5", "tokens": 3329, "verdict": "KEEP"}
{"round": "mass_80", "base": "mass_79", "label": "mass_80", "passed": "5/5", "tokens": 3715, "verdict": "KEEP"}
{"round": "mass_81", "base": "mass_80", "label": "mass_81", "passed": "5/5", "tokens": 3457, "verdict": "KEEP"}
{"round": "mass_82", "base": "mass_81", "label": "mass_82", "passed": "5/5", "tokens": 4472, "verdict": "KEEP"}
{"round": "mass_83", "base": "mass_82", "label": "mass_83", "passed": "5/5", "tokens": 3440, "verdict": "KEEP"}
{"round": "mass_84", "base": "mass_83", "label": "R106 batch19 84 cloud (harness fx39+40)", "passed": "5/5", "tokens": 3293, "verdict": "KEEP"}
{"round": "mass_85", "base": "mass_84", "label": "R108 batch20 85 cloud", "passed": "5/5", "tokens": 4846, "verdict": "KEEP"}
{"round": "mass_86", "base": "mass_85", "label": "R108 batch20 86 cloud", "passed": "5/5", "tokens": 3843, "verdict": "KEEP"}
{"round": "mass_87", "base": "mass_86", "label": "R108 batch20 87 cloud", "passed": "5/5", "tokens": 3706, "verdict": "KEEP"}
{"round": "mass_88", "base": "mass_87", "label": "R108 batch20 88 cloud", "passed": "5/5", "tokens": 3982, "verdict": "KEEP"}
{"round": "mass_89", "base": "mass_88", "label": "R108 batch20 89 cloud", "passed": "5/5", "tokens": 3429, "verdict": "KEEP"}
{"round": "mass_90", "base": "mass_89", "label": "R109 batch21 90 post-fix41", "passed": "5/5", "tokens": 3770, "verdict": "KEEP"}
{"round": "mass_91", "base": "mass_90", "label": "R109 batch21 91 post-fix41", "passed": "5/5", "tokens": 4091, "verdict": "KEEP"}
{"round": "mass_92", "base": "mass_91", "label": "R109 batch21 92 post-fix41", "passed": "5/5", "tokens": 3520, "verdict": "KEEP"}
{"round": "mass_93", "base": "mass_92", "label": "R109 batch21 93 post-fix41", "passed": "5/5", "tokens": 3910, "verdict": "KEEP"}
{"round": "mass_94", "base": "mass_93", "label": "R109 batch21 94 post-fix41", "passed": "5/5", "tokens": 3672, "verdict": "KEEP"}
{"round": "mass_95", "base": "mass_94", "label": "", "passed": "4/5", "tokens": 4129, "verdict": "REVERT", "tokens_delta": 457, "tokens_pct": 12.4, "wall_delta_ms": 44881, "improved": [], "regressed": ["C01_general_qa"], "per_case": [{"id": "C03_subtask", "dtokens": 639}, {"id": "C06_executive_unit_convert", "dtokens": 0}, {"id": "C08_reasoning", "dtokens": 113}, {"id": "C11_json_format", "dtokens": 100}]}
{"round": "mass_96", "base": "mass_95", "label": "", "passed": "4/5", "tokens": 2861, "verdict": "REVERT", "tokens_delta": -1268, "tokens_pct": -30.7, "wall_delta_ms": -39163, "improved": ["C01_general_qa"], "regressed": ["C03_subtask"], "per_case": [{"id": "C06_executive_unit_convert", "dtokens": 0}, {"id": "C08_reasoning", "dtokens": 400}, {"id": "C11_json_format", "dtokens": -90}]}
{"round": "mass_97", "base": "mass_96", "label": "R110 batch22 97", "passed": "5/5", "tokens": 3378, "verdict": "REVIEW", "tokens_delta": 517, "tokens_pct": 18.1, "wall_delta_ms": -31199, "improved": ["C03_subtask"], "regressed": [], "per_case": [{"id": "C01_general_qa", "dtokens": -1}, {"id": "C06_executive_unit_convert", "dtokens": 0}, {"id": "C08_reasoning", "dtokens": -390}, {"id": "C11_json_format", "dtokens": -80}]}
{"round": "mass_99-100系列", "verdict": "RETIRED", "note": "fix#42 前共享 telemetry 单文件时序竞争, 间歇 llm_calls=0 误判; 诊断性数据不作批测口径"}
{"round": "mass_101", "base": "mass_94", "label": "R110 batch22 101 fix42b", "passed": "5/5", "tokens": 4265, "verdict": "KEEP"}
{"round": "mass_102", "base": "mass_101", "label": "R110 batch22 102 fix42b", "passed": "5/5", "tokens": 4277, "verdict": "KEEP"}
{"round": "mass_103", "base": "mass_102", "label": "R110 batch22 103 fix42b", "passed": "5/5", "tokens": 4501, "verdict": "KEEP"}
{"round": "mass_104", "base": "mass_103", "label": "R110 batch22 104 fix42b", "passed": "5/5", "tokens": 4184, "verdict": "KEEP"}
{"round": "mass_105", "base": "mass_104", "label": "R110 batch22 105 fix42b", "passed": "5/5", "tokens": 4327, "verdict": "KEEP"}
{"round":"mass_106-107","verdict":"RETIRED","note":"环境事故: AOT 强刷删 bin 导致 harness --no-build CLI 崩, 非代码问题"}
{"round": "mass_108", "label": "R111 batch23 108", "passed": "5/5", "tokens": 3632, "verdict": "KEEP"}
{"round": "mass_109", "label": "R111 batch23 109", "passed": "5/5", "tokens": 4397, "verdict": "KEEP"}
{"round": "mass_110", "label": "R111 batch23 110", "passed": "5/5", "tokens": 3603, "verdict": "KEEP"}
{"round": "mass_111", "label": "R111 batch23 111", "passed": "5/5", "tokens": 3857, "verdict": "KEEP"}
{"round": "mass_112", "label": "R111 batch23 112", "passed": "5/5", "tokens": 3957, "verdict": "KEEP"}
{"round": "mass_113", "label": "R112 batch24 113", "passed": "5/5", "tokens": 3481, "verdict": "KEEP"}
{"round": "mass_114", "label": "R112 batch24 114", "passed": "5/5", "tokens": 3430, "verdict": "KEEP"}
{"round": "mass_115", "label": "R112 batch24 115", "passed": "5/5", "tokens": 3365, "verdict": "KEEP"}
{"round": "mass_116", "label": "R112 batch24 116", "passed": "5/5", "tokens": 3948, "verdict": "KEEP"}
{"round": "mass_117", "label": "R112 batch24 117", "passed": "5/5", "tokens": 3226, "verdict": "KEEP"}
